Severe Weather - Thunderstorms;6/29/2012;23:30;6/30/2012;2:00;Exelon Corporation/ComEd;Northeast Illinois;Unknown;109000;severe weather, thunderstorm
Vandalism;6/4/2011;1:17;6/4/2011;3:25;Pacific Gas and Electric;Midway, California;Unknown;420;vandalism
Severe Weather;6/2/2011;23:45;6/4/2011;16:00;South Carolina Electric and Gas;Greater Columbia, South Carolina;0;50465;severe weather
Severe Weather - Tornados;5/31/2013;18:00;6/4/2013;10:30;Oklahoma Gas & Electric Co;El Reno, S. Oklahoma City, Oklahoma;Unknown;127000;severe weather, tornado
Electrical System Separation (Islanding);6/5/2011;20:02;6/5/2011;20:55;Pacific Gas and Electric;Melones, California;10;5314;islanding
Severe Weather - Thunderstorms;6/5/2014;13:06;6/5/2014;13:07;Tennessee Valley Authority;West Tennessee;Unknown;56475;severe weather, thunderstorm
Load Shed/ Automatic undervoltage relay action;6/6/2011;0:13;6/6/2011;3:15;El Paso Electric Company;El Paso County, Texas, Dona Ana County, New Mexico;450;162000;load shedding
Severe Thunderstorms;6/5/2011;5:30;6/6/2011;1:30;CenterPoint Energy;Houston Metro-Area, Texas;473;78000;severe weather, thunderstorm
Vandalism;6/6/2012;0:37;6/6/2012;0:37;Potomac Electric Power Company (PEPCO);Columbia Heights, NW, Washington DC;0;0;vandalism
Vandalism;6/6/2012;8:00;6/6/2012;8:00;New York Power Authority;Delhi, New York;Unknown;Unknown;vandalism
Severe Weather - Thunderstorms;6/5/2014;3:00;6/7/2014;23:45;Memphis Light Gas and Water Division;Shelby County, Tennessee;494;38500;severe weather, thunderstorm
Vandalism;6/8/2011;0:58;6/8/2011;0:58;Tacoma Power (TPWR);Fredrickson Substation, Washington;Unknown;Unknown;vandalism
Severe Weather;6/7/2011;14:00;6/8/2011;6:00;American Electric Power;Ohio;Unknown;52747;severe weather
Public Appeal to Reduce Electricity Usage;6/6/2011;15:00;6/8/2011;15:00;West Memphis Utilities;Eastern, Arkansas;Unknown;13000;public appeal
Load Shed;6/8/2012;17:20;6/8/2012;17:25;Public Service Company of Colorado;Denver Metro Area, Colorado;120;30379;load shedding
Severe Weather - Thunderstorms;6/7/2014;23:00;6/8/2014;5:30;Southern Company;North and Central , Alabama;217;65000;severe weather, thunderstorm
Suspected Physical Attack;6/9/2011;14:15;6/9/2011;14:15;Southern California Edison (SCE);San Antonio Dam Area, Los Angeles County, California;0;0;vandalism, physical
Severe Thunderstorms;6/9/2011;4:30;6/9/2011;12:00;Exelon Corporation/ComEd;Illinois;Unknown;169000;severe weather, thunderstorm
Electrical System Islanding;6/9/2014;11:07;6/9/2014;11:30;Peak Reliability;Alberta, Canada;Unknown;Unknown;islanding
Vandalism;7/1/2011;16:38;7/1/2011;22:38;Dayton Power & Light;Greene County Ohio;Unknown;0;vandalism
Vandalism;7/1/2011;8:00;7/1/2011;8:01;ISO New England;CONVEX Local Control Center, Connecticut;0;0;vandalism
Severe Weather;6/30/2011;22:30;7/1/2011;17:00;Exelon Corporation/ComEd;Illinois;Unknown;121000;severe weather
Operational Failure, Storm Damage;7/1/2012;16:47;7/1/2012;23:00;North Carolina Municipal Power Agency #1;Tarboro, North Carolina;48;6100;equipment failure, severe weather, storm
Severe Weather;7/1/2012;17:45;7/1/2012;22:15;Progress Energy, Carolinas;Northern, Central and Eastern North Carolina;Unknown;69106;severe weather
Severe Weather - Thunderstorms;6/30/2014;23:20;7/1/2014;17:00;Northern Indiana Public Service Company;North Central Indiana;Unknown;127000;severe weather, thunderstorm
Severe Weather - Thunderstorms;6/30/2014;17:55;7/1/2014;2:53;We Energies;Southeast  Wisconsin;424;120000;severe weather, thunderstorm
Fuel Supply Deficiency (Water);7/7/2012;4:00;7/10/2012;4:00;California Department of Water Resources;CAISO California;Unknown;0;fuel supply emergency, hydro
Physical Attack, Copper Theft;7/10/2013;14:30;7/10/2013;14:45;ISO New England;Boston, Massachusetts;0;0;vandalism, physical
Vandalism;7/11/2011;13:30;7/11/2011;13:30;Central Maine Power Company;Maine;Unknown;0;vandalism
Vandalism;7/11/2011;13:13;7/11/2011;13:13;Duke Energy;Southwest Ohio;0;0;vandalism
Severe Weather;7/11/2011;9:00;7/11/2011;10:25;Detroit Edison, Subsidiary of DTE Energy;Michigan;254;103000;severe weather
Severe Weather;7/11/2011;9:00;7/11/2011;9:00;Exelon Corporation/ComEd;Illinois;Unknown;500000;severe weather
Suspected Cyber Attack;7/8/2011;10:00;7/11/2011;9:00;PJM Interconnection;PJM Corporate Office, Pennsylvania;Unknown;Unknown;vandalism, cyber
Severe Weather - Thunderstorms;7/10/2013;17:30;7/11/2013;20:00;American Electric Power;AEP Ohio Power Footprint;Unknown;122314;severe weather, thunderstorm
Suspected Physical Attack;7/12/2011;20:20;7/12/2011;21:30;Gen On;California;Unknown;Unknown;vandalism, physical
Vandalism;7/12/2011;0:00;7/12/2011;0:00;Central Maine Power Company;Maine;Unknown;0;vandalism
Severe Weather;7/11/2011;14:27;7/12/2011;15:50;American Electric Power (AEP);Indiana, Michigan, Ohio;Unknown;120000;severe weather
Severe Weather;7/11/2011;11:15;7/12/2011;8:15;Consumers Energy;Western and Southern Lower Peninsula Michigan;Unknown;85000;severe weather
Physical Attack, Vandalism;7/12/2013;10:00;7/12/2013;10:01;Tacoma Power (TPWR);Washington;Unknown;Unknown;vandalism, physical
Load Shed;7/13/2011;17:19;7/13/2011;22:03;Public Service Company of Colorado;Pueblo, Colorado;580;Unknown;load shedding
Public Appeal to Reduce Electricity Usage;7/14/2011;11:00;7/14/2011;19:00;ERCOT ISO;Texas;0;0;public appeal
Physical Attack, Vandalism;7/11/2013;23:20;7/14/2013;15:22;Arizona Public Service Co;Arizona;455;Unknown;vandalism, physical
Public Appeal to Reduce Energy Usage;7/16/2012;11:27;7/16/2012;12:29;North Little Rock Electric Department;Little Rock, Arkansas;Unknown;Unknown;public appeal
Severe Weather - Thunderstorms;7/18/2012;16:20;7/18/2012;19:05;American Electric Power (AEP);Eastern Ohio;Unknown;67000;severe weather, thunderstorm
Physical Attack, Vandalism;7/18/2013;3:15;7/18/2013;3:59;PacifiCorp;Utah;Unknown;Unknown;vandalism, physical
Vandalism;7/19/2011;11:45;7/19/2011;15:00;Central Maine Power Company;Maine;Unknown;Unknown;vandalism
Vandalism;7/19/2012;0:32;7/19/2012;0:33;Delmarva Power & Light Company;Newark, Delaware;Unknown;Unknown;vandalism
Severe Weather - Thunderstorms;7/18/2012;14:16;7/19/2012;23:58;Duke Energy Midwest;Southeast Ohio, Northern Kentucky, Southern Indiana;480;103000;severe weather, thunderstorm
Severe Weather - Thunderstorms;7/18/2012;23:00;7/19/2012;6:00;Exelon Corporation/ComEd;Northern Illinois;Unknown;181000;severe weather, thunderstorm
Public Appeal - Heatwave;7/18/2013;11:30;7/19/2013;17:30;Niagara Mohawk Power Corp.;Upstate New York;Unknown;Unknown;public appeal, severe weather, heat
Equipment Failure;7/18/2013;23:45;7/19/2013;10:05;San Diego Gas & Electric Co;Southern Orange County California;200;123000;equipment failure
Fuel Supply Emergency (Natural Gas);7/17/2013;15:30;7/19/2013;6:45;Long Island Power Authority;Holtsville, New York;417;Unknown;fuel supply emergency, natural gas
Public Appeal to Reduce Electricity Usage;6/30/2012;15:00;7/2/2012;0:00;Tennessee Valley Authority (TVA);Northeast Tennessee;Unknown;Unknown;public appeal
Severe Weather - Thunderstorms;6/30/2012;22:30;7/2/2012;8:11;Southern Maryland Electric Cooperative, Inc.;Calvert, Charles, St. Mary's, Prince Georges Counties Maryland;354;60000;severe weather, thunderstorm
Severe Weather - Thunderstorms;6/29/2012;17:15;7/2/2012;23:59;Duke Energy Midwest;Eastern Indiana, Northern Kentucky, Greater Cincinnati area Ohio;2946;4645572;severe weather, thunderstorm
Severe Weather - Thunderstorms;6/29/2012;16:00;7/2/2012;16:00;American Electric Power (AEP);Indiana, Michigan, Ohio, West Virginia;Unknown;1355919;severe weather, thunderstorm
Severe Weather - Thunderstorms;6/30/2014;20:00;7/2/2014;18:30;Exelon Corporation/ComEd;Illinois;Unknown;420000;severe weather, thunderstorm
Fire;7/20/2002;0:40;7/20/2002;8:12;Consolidated Edison Co. of New York;New York;278;63500;wild fire
Vandalism;7/20/2011;9:10;7/20/2011;16:30;Tacoma Power (TPWR);Frederickson Substation, Washington;Unknown;Unknown;vandalism
Severe Weather - Thunderstorms;7/19/2013;18:00;7/20/2013;9:00;Detroit Edison Co;Michigan;Unknown;156627;severe weather, thunderstorm
Public Appeal to Reduce Electricity Usage;7/21/2011;13:00;7/21/2011;15:00;City Water Light and Power;Springfield, Illinois;Unknown;Unknown;public appeal
Severe Weather, Equipment Failure;7/21/2012;2:19;7/21/2012;5:20;Lubbock Power and Light;City of Lubbock, Texas;220;70000;severe weather, equipment failure
Severe Weather - Thunderstorms;7/19/2013;22:30;7/21/2013;20:00;Niagara Mohawk Power Corporation (dba National Grid);New York;Unknown;74300;severe weather, thunderstorm
Public Appeal to Reduce Electricity Usage;7/22/2011;11:00;7/22/2011;18:00;Niagara Mohawk Power Corporation (dba National Grid);Upstate, New York;Unknown;Unknown;public appeal
Load Shed;7/22/2011;11:34;7/22/2011;17:26;PJM Interconnection;Ohio;206;23000;load shedding
Public Appeal to Reduce Electricity Usage;7/21/2011;12:32;7/22/2011;6:30;Consumers Energy;Lower Peninsula, Michigan;8881;Unknown;public appeal
Physical Attack, Vandalism;7/22/2013;7:00;7/22/2013;15:00;Terra-Gen Operating Company;California;Unknown;Unknown;vandalism, physical
Vandalism;7/24/2011;14:34;7/24/2011;15:47;Public Service of NH (Northeast Utilities);Southern, New Hampshire;0;0;vandalism
Severe Weather;7/23/2011;2:30;7/24/2011;9:00;Exelon Corporation/ComEd;Illinois;Unknown;169000;severe weather
Severe Weather;7/18/2011;17:00;7/24/2011;13:30;Detroit Edison, Subsidiary of DTE Energy;Southeast Michigan;Unknown;197166;severe weather
Severe Weather - Thunderstorms;7/24/2012;7:30;7/24/2012;22:00;Exelon Corporation/ComEd;Northern Illinois;Unknown;330000;severe weather, thunderstorm
Severe Weather - Thunderstorms;7/24/2012;7:01;7/24/2012;16:30;Northern Indiana Public Service Company;Northern Indiana;Unknown;82621;severe weather, thunderstorm
Physical Attack, Vandalism;7/25/2013;13:10;7/25/2013;13:15;Tacoma Power (TPWR);Polk Substation, Tacoma Washington;Unknown;Unknown;vandalism, physical
Severe Weather - Thunderstorms;7/23/2013;23:38;7/25/2013;4:30;American Electric Power;Tulsa, Oklahoma;500;92748;severe weather, thunderstorm
Vandalism;7/26/2011;0:01;7/26/2011;0:01;Western Farmers Electric Cooperative;Backup Control Center, Oklahoma;0;0;vandalism
Vandalism;7/27/2011;0:07;7/27/2011;0:08;Tacoma Power (TPWR);Fife, Washington;Unknown;Unknown;vandalism
Severe Weather - Thunderstorms;7/26/2012;18:14;7/27/2012;18:14;FirstEnergy Corp.: Pennsylvania Electric Company;Western Pennsylvania;Unknown;65112;severe weather, thunderstorm
Severe Weather - Thunderstorms;7/26/2012;18:30;7/27/2012;17:22;American Electric Power (AEP);Eastern Ohio;Unknown;57054;severe weather, thunderstorm
Vandalism;7/28/2011;19:25;7/28/2011;19:25;City of Tacoma (TPWR);Spanaway, Washington;Unknown;Unknown;vandalism
Vandalism;7/28/2011;13:32;7/28/2011;13:32;Northern Indiana Public Service Company (NIPSCO);Indiana;Unknown;Unknown;vandalism
Severe Weather - Thunderstorms;7/27/2012;17:19;7/28/2012;17:19;Duke Energy Midwest;Central Indiana;Unknown;52702;severe weather, thunderstorm
Severe Weather - Thunderstorms;7/26/2012;18:21;7/28/2012;23:30;PPL Electric Utilities Corp;North/Central Pennsylvania;Unknown;65000;severe weather, thunderstorm
Vandalism;7/29/2011;11:46;7/29/2011;17:00;City of Tacoma (TPWR);Fredrickson, Washington;Unknown;Unknown;vandalism
Severe Weather;7/28/2011;0:14;7/29/2011;0:00;Exelon Corporation/ComEd;Entire ComEd Territory, Indiana;Unknown;201000;severe weather
Fuel Supply Deficiency (Coal);7/28/2011;7:26;7/29/2011;7:26;Owensboro Municipal Utilities;Daviess County, Kentucky;Unknown;Unknown;fuel supply emergency, coal
Severe Weather;7/1/2011;17:00;7/3/2011;20:00;Xcel Energy Northern States Power Company;Southwest and South Central Minnesota;Unknown;70000;severe weather
Severe Weather - Thunderstorms;7/1/2012;13:00;7/3/2012;15:00;Exelon Corporation/ComEd;Illinois;Unknown;320000;severe weather, thunderstorm
Severe Weather - Thunderstorms;6/30/2012;1:00;7/3/2012;1:00;Delmarva Power & Light Company;Delaware, Maryland;0;86390;severe weather, thunderstorm
Voltage Reduction, Line and Generator Trip;7/3/2013;0:04;7/3/2013;0:48;Puerto Rico Electric Power Authority;System-wide Puerto Rico;480;393000;voltage reduction, generator trip
Suspected Physical Attack;7/3/2013;9:34;7/3/2013;10:52;Sacramento Municipal Utility District;Sacramento California;0;0;vandalism, physical
Fuel Supply Deficiency (Coal);7/19/2012;10:30;7/31/2012;11:00;Somerset Operating Company;Niagara County, New York;675;Unknown;fuel supply emergency, coal
Severe Weather;7/4/2011;18:00;7/4/2011;21:00;Dominion Virginia Power;Virginia;150;51580;severe weather
Severe Weather - Thunderstorms;6/29/2012;14:10;7/4/2012;18:00;Dayton Power & Light;Dayton, Ohio;500;175000;severe weather, thunderstorm
Severe Weather - Thunderstorms;6/29/2012;22:29;7/4/2012;15:36;Dominion;Virginia;5000;880000;severe weather, thunderstorm
Vandalism;7/5/2011;10:40;7/5/2011;11:37;PacifiCorp;West Valley Substation Utah;0;0;vandalism
Severe Weather - Thunderstorms;6/29/2012;22:15;7/5/2012;0:52;Pepco;Montgomery and Prince Georges Counties, Maryland, District of Columbia;3000;425000;severe weather, thunderstorm
Severe Weather - Thunderstorms;6/29/2012;22:43;7/5/2012;11:50;Baltimore Gas & Electric Company (BGE);Greater Baltimore area, Maryland;1465;600000;severe weather, thunderstorm
Physical Attack, Vandalism;7/5/2013;0:05;7/5/2013;1:51;Pacific Gas & Electric Co;California;Unknown;2500;vandalism, physical
Load Shed 100+MW;7/2/2013;14:20;7/5/2013;15:30;Western Electricity Coordinating Council;Alberta, Canada;200;Unknown;load shedding
Vandalism;7/6/2011;9:51;7/6/2011;9:52;ISO New England;Vermont;Unknown;Unknown;vandalism
Severe Weather;7/2/2011;20:15;7/6/2011;22:00;Detroit Edison, Subsidiary of DTE Energy;South East, Lower Peninsula, Michigan;Unknown;182000;severe weather
Vandalism;7/6/2012;15:05;7/6/2012;15:06;City of Tacoma - TPWR;Tacoma, Washington;Unknown;Unknown;vandalism
Severe Weather - Thunderstorms;7/5/2012;0:00;7/6/2012;20:30;Consumers Energy;Lower Peninsula Michigan;Unknown;111000;severe weather, thunderstorm
Severe Weather - Wind & Storms;7/5/2012;19:00;7/6/2012;16:00;Tennessee Valley Authority (TVA);Northeast Tennessee;Unknown;50001;severe weather, wind, storm
Severe Weather - Thunderstorms;6/29/2012;18:24;7/6/2012;10:00;FirstEnergy (Mon Power);West Virginia;700;265000;severe weather, thunderstorm
Severe Weather - Thunderstorms;6/30/2012;1:15;7/7/2012;17:33;Atlantic City Electric;Atlantic City Electric Service Territory New Jersey;Unknown;205000;severe weather, thunderstorm
Severe Weather - Thunderstorms;6/29/2012;19:00;7/7/2012;19:43;FirstEnergy (Potomac Edison);Maryland, West Virginia;Unknown;145000;severe weather, thunderstorm
Vandalism;7/8/2011;10:00;7/8/2011;10:00;Minnesota Power;Saginaw, Minnesota;0;0;vandalism
Energy Deficiency Alert;7/9/2012;12:15;7/9/2012;16:14;WECC RC Vancouver;Alberta, Canada;9896;Unknown;energy deficiency alert
Severe Weather - Thunderstorms;7/7/2012;6:06;7/9/2012;23:00;PPL Electric Utilities Corp;Lower Valley, Central, Susquehanna Regions Pennsylvania;Unknown;64500;severe weather, thunderstorm
Severe Weather - Thunderstorms;7/7/2012;18:00;7/9/2012;19:01;FirstEnergy Corp. Jersey Central Power & Light;Central and Northern New Jersey;Unknown;95400;severe weather, thunderstorm
Vandalism;8/1/2011;14:18;8/1/2011;14:18;PacificCorp;Jefferson, Oregon;Unknown;Unknown;vandalism
Severe Weather;7/29/2011;20:45;8/1/2011;4:24;FirstEnergy Corp: Jersey Central Power & Light;Central New Jersey;Unknown;67900;severe weather
Public Appeal to Reduce Electricity Usage;8/1/2012;0:00;8/1/2012;0:00;Oklahoma Gas & Electric Co;Oklahoma, Arkansas;Unknown;Unknown;public appeal
Electrical System Separation (Islanding;8/1/2013;18:54;8/1/2013;19:37;WECC RC Vancouver;Western British Columbia;420;Unknown;islanding
Physical Attack, Copper Theft;8/1/2013;11:00;8/1/2013;16:00;Central Hudson Gas & Electric;Newburgh, New York;Unknown;Unknown;vandalism, physical
Severe Weather;8/8/2011;20:58;8/10/2011;16:30;Oklahoma Gas & Electric;Northern and Central Oklahoma;Unknown;54000;severe weather
Suspected Physical Attack;8/11/2012;12:45;8/11/2012;17:00;City of Tacoma, TPWR;Tacoma, Washington;Unknown;Unknown;vandalism, physical
Suspicious Activity;8/12/2013;11:55;8/12/2013;11:59;PacifiCorp;Portland, Oregon;Unknown;Unknown;vandalism
Severe Weather - Dust Storm, Load Shed Event;8/13/2012;15:52;8/13/2012;19:44;WECC Reliability Coordinator;CFE (Mexico & U.S.);655;Unknown;severe weather, dust, load shedding
Vandalism;8/13/2012;13:15;8/13/2012;13:15;Tennessee Valley Authority;Knoxville, Tennessee;Unknown;Unknown;vandalism
Severe Weather;8/13/2011;16:41;8/14/2011;19:00;LG&E and KU Energy LLC;Kentucky;Unknown;181700;severe weather
Vandalism;8/15/2011;2:05;8/15/2011;3:40;PacifiCorp;Utah;0;0;vandalism
Vandalism;8/16/2012;13:13;8/16/2012;13:13;Northern Indiana Public Service Company;Northern Indiana;0;0;vandalism
Severe Weather - Thunderstorms;8/16/2013;16:58;8/17/2013;23:58;CenterPoint Energy;Houston Service Area Texas;Unknown;219681;severe weather, thunderstorm
Suspected Physical Attack;8/18/2011;9:51;8/18/2011;16:00;City of Tacoma (TPWR);Collins Substation, Washington;Unknown;Unknown;vandalism, physical
Fuel Supply Deficiency (Coal);8/3/2011;10:00;8/19/2011;10:00;AES Somerset LLC;Western New York;675;Unknown;fuel supply emergency, coal
Suspected Physical Attack;8/19/2012;8:42;8/19/2012;12:08;El Paso Electric Co;El Paso, Texas;12;3314;vandalism, physical
Interruption of Firm Power;8/2/2002;0:43;8/2/2002;6:36;Central Illinois Light Co.;Illinois;232;53565;load shedding
Loss of 300+ MW Load;8/1/2013;23:19;8/2/2013;12:49;Florida Power & Light Co;Daytona Beach Florida;297;104498;load shedding
Severe Weather - Lightning Strike;8/19/2013;19:06;8/20/2013;6:02;Southern California Edison Co;Central California;685;124000;severe weather, thunderstorm
Physcial Attack, Sabotage;8/21/2013;14:00;8/21/2013;14:01;Entergy Arkansas Inc;Cabot, Arkansas;Unknown;Unknown;vandalism, physical
Suspected Physical Attack;8/22/2011;10:05;8/22/2011;16:00;City of Tacoma (TPWR);Collins Substation, Washington;Unknown;Unknown;vandalism, physical
Physcial Attack, Vandalism;8/22/2013;12:55;8/22/2013;14:45;Delmarva Power & Light Company;New Castle, Delaware;Unknown;Unknown;vandalism, physical
Physcial Attack, Sabotage;8/22/2013;8:40;8/22/2013;11:49;Constellation Energy Control & Dispatch - for Gila River;Gila River, Arizona;Unknown;Unknown;vandalism, physical
Public Appeal to Reduce Electricity Usage;8/23/2011;15:43;8/23/2011;19:00;ERCOT ISO;Texas;0;0;public appeal
Public Appeal to Reduce Electricity Usage;8/23/2011;10:30;8/23/2011;16:54;Southwestern Public Service Company;Southeastern New Mexico,  Texas Panhandle;0;0;public appeal
Earthquake;8/23/2011;13:51;8/23/2011;13:51;Dominion Virginia Power;Virginia;0;0;earthquake
Severe Weather;8/21/2011;22:45;8/23/2011;22:45;Puerto Rico Electric Power Authority (PREPA);Puerto Rico;2200;931000;severe weather
Severe Weather;8/20/2011;17:42;8/23/2011;20:00;Detroit Edison, Subsidiary of DTE Energy;Southeastern Michigan;254;65000;severe weather
Physcial Attack, Vandalism;8/23/2013;7:30;8/23/2013;7:31;Delmarva Power & Light Company;New Castle, Delaware;Unknown;Unknown;vandalism, physical
Severe Weather;8/24/2011;14:51;8/24/2011;22:00;American Electric Power (AEP);Arkansas, Louisiana, Texas;Unknown;53064;severe weather
Suspected Physical Attack;8/25/2011;0:01;8/25/2011;12:01;Central Maine Power Company;Maine;0;0;vandalism, physical
Severe Weather;8/24/2011;7:45;8/25/2011;6:00;CenterPoint Energy;Houston area, Texas;485;79000;severe weather
Physcial Attack, Vandalism;8/26/2013;20:15;8/26/2013;20:16;Tacoma Power (TPWR);Tacoma Washington;Unknown;Unknown;vandalism, physical
Distribution System Interruption;8/27/2011;2:00;8/27/2011;5:15;Town of Stantonsburg JRO;Wilson County North Carolina;2;1200;distribution interruption
Severe Weather - TS Isaac;8/26/2012;22:04;8/27/2012;2:04;Florida Power & Light;Florida;Unknown;440000;severe weather, hurricane/tropical storm
Severe Weather;8/28/2002;2:09;8/28/2002;3:38;Lakeworth Utils;Florida;67.6;25000;severe weather
Suspected Physical Attack;8/28/2011;20:55;8/28/2011;23:39;PacifiCorp;Calapooya Substation, Oregon;0;0;vandalism, physical
Severe Weather;8/28/2011;0:30;8/28/2011;0:31;Orange and Rockland Utilities, Inc.;New York;Unknown;116000;severe weather
Severe Weather;8/28/2011;0:10;8/28/2011;0:11;ISO New England;Eastern Massachusetts;Unknown;50000;severe weather
Severe Weather;8/26/2011;0:30;8/28/2011;12:30;FirstEnergy Corp: Metropolitan Edison Company;Pennsylvania;Unknown;200717;severe weather
Severe Weather;8/25/2011;0:30;8/28/2011;20:00;FirstEnergy Corp: Cleveland Electric Illuminating Company;Cleveland area, Ohio;Unknown;107833;severe weather
Physcial Attack, Vandalism;8/28/2013;9:30;8/28/2013;9:31;PacifiCorp;Sweetwater County Wyoming;Unknown;Unknown;vandalism, physical
Severe Weather;8/28/2011;7:40;8/29/2011;7:40;The United illuminating Company;Southwest Connecticut;Unknown;158000;severe weather
Severe Weather;8/27/2011;2:57;8/29/2011;23:30;Progress Energy Carolinas;Eastern North Carolina;Unknown;285465;severe weather
Severe Weather;8/27/2011;22:00;8/29/2011;22:00;Exelon Corporation / PECO;Pennsylvania;Unknown;264000;severe weather
Severe Weather;8/27/2011;22:00;8/29/2011;16:00;Atlantic City Electric Company;Southern New Jersey;320;140000;severe weather
Severe Weather;8/27/2011;10:33;8/29/2011;14:00;Dominion Virginia Power;North Carolina, Virginia;Unknown;1000000;severe weather
Severe Weather;8/27/2011;19:00;8/29/2011;13:31;North Carolina Eastern Municipal Power Agency;Eastern North Carolina;200;136000;severe weather
Severe Weather;8/27/2011;13:00;8/29/2011;13:00;Delmarva Power & Light Company;Delaware, Maryland;Unknown;165000;severe weather
Severe Weather;8/27/2011;23:00;8/29/2011;8:00;Southern Maryland Electric Cooperative (SMECO);Maryland;Unknown;108000;severe weather
Public Appeal to Reduce Electricity Usage;8/24/2011;13:20;8/29/2011;19:00;ERCOT ISO;Texas;0;0;public appeal
Electrical System Separation (Islanding), Severe Weather;8/29/2013;14:57;8/29/2013;15:29;Xcel Energy;Ashland, Wisconsin;15;7000;islanding, severe weather
Physcial Attack, Vandalism;8/29/2013;9:50;8/29/2013;9:50;Empire District Electric Co;Joplin, Missouri;Unknown;Unknown;vandalism, physical
Public Appeal to Reduce Electricity Usage;8/3/2011;16:29;8/3/2011;23:40;Grand River Dam Authority;Northeast Oklahoma;300;Unknown;public appeal
Public Appeal to Reduce Electricity Usage;8/3/2011;16:30;8/3/2011;21:00;Entergy;Central Arkansas;0;0;public appeal
Severe Weather;8/2/2011;21:30;8/3/2011;19:00;Exelon Corporation/ComEd;Northeast, Illinois;Unknown;71500;severe weather
Public Appeal to Reduce Electricity Usage;8/2/2011;10:15;8/3/2011;9:16;Oklahoma Gas & Electric;Oklahoma;Unknown;Unknown;public appeal
Severe Weather;8/28/2011;5:00;8/30/2011;5:00;Long Island Power Authority;Long Island, New York;Unknown;152261;severe weather
Severe Weather;8/28/2011;2:58;8/30/2011;2:58;PPL Electric Utilities;Eastern and Northeastern Pennsylvania;110;284000;severe weather
Severe Weather;8/28/2011;0:30;8/30/2011;12:30;FirstEnergy Corp: Jersey Central Power & Light;Northern and Central New Jersey;Unknown;650000;severe weather
Severe Weather;8/28/2011;0:23;8/30/2011;12:23;Public Service Electric and Gas Company;New Jersey;500;665000;severe weather
Severe Weather;8/28/2011;9:42;8/30/2011;12:01;Niagara Mohawk Power Corporation;Eastern New York;Unknown;100000;severe weather
Severe Weather;8/28/2011;0:01;8/30/2011;12:01;Central Hudson Gas & Electric;Mid-Hudson, New York;Unknown;180000;severe weather
Severe Weather - Hurricane Isaac;8/29/2012;6:53;8/30/2012;14:00;Dixie Electric Membership Corp;Louisiana;150;68018;severe weather, hurricane/tropical storm
Suspected Physical Attack;8/31/2011;0:52;8/31/2011;0:52;Duke Energy;Southwest Ohio;0;0;vandalism, physical
Severe Weather - Hurricane Isaac;8/29/2012;9:48;8/31/2012;0:55;Cleco Power LLC;Louisiana;Unknown;95000;severe weather, hurricane/tropical storm
Severe Weather - Hurricane Isaac;8/29/2012;9:00;8/31/2012;0:00;Louisiana Generating LLC;Louisiana;300;50000;severe weather, hurricane/tropical storm
Severe Weather - Thunderstorms;8/30/2013;19:30;8/31/2013;1:30;Exelon Corporation/ComEd;Entire ComEd territory Illinois;Unknown;157000;severe weather, thunderstorm
Public Appeal to Reduce Electricity Usage;8/4/2011;10:30;8/4/2011;16:00;American Electric Power (AEP);Arkansas, Oklahoma, Texas;Unknown;Unknown;public appeal
Severe Weather - Thunderstorms;8/4/2012;4:00;8/4/2012;7:20;Northern Indiana Public Service Company;Northern Indiana;Unknown;61413;severe weather, thunderstorm
Electrical System Separation (Islanding);8/4/2012;3:55;8/4/2012;4:21;Pacific Gas & Electric Co;Temblor Substation in McKittrick, California;5;127;islanding
Physical Attack, Vandalism;8/4/2013;3:00;8/4/2013;4:00;Pacificorp;Utah;Unknown;Unknown;vandalism, physical
Public Appeal to Reduce Electricity Usage;8/1/2011;15:00;8/5/2011;19:00;ERCOT ISO;Texas;0;0;public appeal
Severe Weather - Thunderstorms;8/4/2012;17:30;8/5/2012;0:10;Exelon Corporation/ComEd;Northeast Illinois;Unknown;325000;severe weather, thunderstorm
Electrical System Separation (Islanding), Severe Weather;8/5/2013;18:35;8/5/2013;18:45;WECC RC Vancouver;Vancouver, British Columbia;Unknown;Unknown;islanding, severe weather
Physcial Attack, Vandalism;8/6/2013;16:00;8/6/2013;17:32;El Paso Electric;Holloman Air Force Base, New Mexico;Unknown;Unknown;vandalism, physical
Severe Weather - Thunderstorms;8/7/2013;0:15;8/7/2013;21:27;We Energies;Eastern Central Wisconsin;220;51160;severe weather, thunderstorm
Fuel Supply Emergency (Natural Gas & Fuel Oil);8/7/2013;7:30;8/7/2013;9:14;Wisconsin Public Service Corp;Green Bay, Wisconsin;Unknown;Unknown;fuel supply emergency, natural gas
Vandalism;8/8/2011;9:35;8/8/2011;16:00;City of Tacoma (TPWR);Collins Substation, Washington;Unknown;Unknown;vandalism
Suspected Physical Attack;8/8/2011;9:30;8/8/2011;9:30;Dayton Power & Light;Greene County, Ohio;0;0;vandalism, physical
