Event Description;Date Event Began;Time Event Began;Date of Restoration;Time of Restoration;Respondent;Geographic Areas;Demand Loss (MW);Number of Customers Affected;Tags
Physical Attack;12/30/2013;11:00;1/1/2014;8:00;Arizona Public Service Co;North of Roosevelt lake Arizona;Unknown;Unknown;vandalism, physical
Load Shed;1/10/2012;21:30;1/10/2012;21:30;Luminant Energy Company LLC;Rusk County, Texas;Unknown;Unknown;load shedding
Electrical Fault at Generator;1/11/2011;23:08;1/11/2011;23:08;New Athens Generating Co. LLC;Athens, New York;0;0;equipment failure
Suspected Physical Attack;1/11/2012;7:19;1/11/2012;9:07;Nevada Power Company (NV Energy);Nevada;0;0;vandalism, physical
Load Shed;1/9/2012;13:36;1/11/2012;1:05;The Dow Chemical Company;Louisiana;150;1;load shedding
Winter Storm;1/12/2011;6:00;1/12/2011;14:00;National Grid;Massachusetts;Unknown;80000;severe weather, winter storm
Physical Attack;1/12/2012;8:26;1/12/2012;8:26;Delmarva Power & Light Company;Newark, Delaware;0;0;vandalism, physical
Firm System Load Shed;1/13/2011;7:21;1/13/2011;8:13;JEA;North Florida;150;20900;load shedding
Physical Attack;1/13/2012;9:20;1/13/2012;9:20;Delmarva Power & Light Company;Newark, Delaware;0;0;vandalism, physical
Physical Attack - Vandalism;1/13/2014;16:44;1/13/2014;16:45;Arizona Public Service Co;Arizona;Unknown;Unknown;vandalism, physical
Vandalism;1/15/2012;9:35;1/15/2012;9:35;Tacoma Power (TPWR);Tacoma, Washington;Unknown;Unknown;vandalism
Physical Attack - Vandalism;1/15/2014;14:32;1/15/2014;14:45;PacifiCorp;Utah;Unknown;Unknown;vandalism, physical
Suspected Physical Attack;1/16/2013;16:45;1/16/2013;19:26;Public Service Company of New Mexico;San Juan County, New Mexico;0;0;vandalism, physical
Physcial Attack - Vandalism;1/16/2013;14:25;1/16/2013;14:25;Delmarva Power & Light Company;Denton, Maryland;Unknown;Unknown;vandalism, physical
Physical Attack, Vandalism;1/16/2014;12:30;1/16/2014;13:57;Arizona Public Service Co;Arizona;Unknown;Unknown;vandalism, physical
Suspected Cyber Attack;1/17/2012;10:31;1/17/2012;17:21;Pedernales Electric Cooperative, Inc.;Austin, Texas;Unknown;0;vandalism, cyber
Distribution Interruption;1/17/2013;20:35;1/17/2013;21:20;North Carolina Eastern M P A;Elizabeth City, North Carolina;40;12000;distribution interruption
Physical Attack;1/16/2013;7:41;1/17/2013;10:58;MidAmerican Energy Co;Webster County, Iowa;Unknown;Unknown;vandalism, physical
Suspected Physical Attack;1/17/2014;0:20;1/17/2014;0:20;Dayton Power & Light Co;Ohio;Unknown;Unknown;vandalism, physical
Vandalism;1/18/2011;14:00;1/18/2011;14:00;National Grid;Whitman, Auburn St Substation, Massachusetts;0;0;vandalism
Public Appeal to Reduce Electricity Usage;1/18/2014;9:00;1/18/2014;9:45;ERCOT;Texas;Unknown;Unknown;public appeal
Severe Weather - Winter Storm;1/17/2013;19:02;1/19/2013;18:00;Tennessee Valley Authority;Northeast Tennessee;Unknown;80000;severe weather, winter storm
Severe Weather - Winter Storm;1/19/2012;7:00;1/20/2012;15:00;Puget Sound Energy;King, Pierce and Thurston Counties, Washington;1600;426000;severe weather, winter storm
Severe Weather - Winter Storm;1/17/2013;18:07;1/20/2013;19:30;American Electric Power (AEP);Southwest Virginia, Southern West Virginia;Unknown;127000;severe weather, winter storm
Physical Attack - Vandalism;1/21/2014;0:14;1/21/2014;0:39;Ameren Missouri;Missouri;10;Unknown;vandalism, physical
Physical Attack - Vandalism;1/22/2014;9:45;1/22/2014;20:19;Duke Energy Midwest;Ohio;Unknown;Unknown;vandalism, physical
Physical Attack - Vandalism;1/22/2014;13:55;1/22/2014;14:55;Madison Gas and Electric;Wisconsin;Unknown;Unknown;vandalism, physical
Physical Attack - Vandalism;1/22/2014;0:30;1/22/2014;2:45;Madison Gas and Electric;Wisconsin;Unknown;Unknown;vandalism, physical
Vandalism;1/23/2011;7:00;1/23/2011;13:00;PacifiCorp;Franklin County, Idaho;0;0;vandalism
Severe Weather - Wind Storm;1/20/2013;3:30;1/23/2013;6:15;Detroit Edison Co;Southeastern Michigan;Unknown;146500;severe weather, wind
Suspected Physical Attack;1/22/2014;21:15;1/23/2014;3:08;Public Service Electric &Gas;Burlington County, New Jersey;Unknown;Unknown;vandalism, physical
Suspicious Activity;1/24/2011;13:20;1/24/2011;13:30;El Paso Electric Company;Newman Power Plant, Texas;0;0;vandalism
Vandalism;1/24/2012;11:22;1/24/2012;11:22;Tacoma Power (TPWR);Tacoma, Washington;Unknown;Unknown;vandalism
Physical Attack - Vandalism;1/24/2014;15:30;1/24/2014;17:00;Madison Gas and Electric;Wisconsin;Unknown;Unknown;vandalism, physical
Physical Attack - Vandalism;1/23/2014;21:17;1/24/2014;17:00;Tacoma Power (TPWR);Wynoochee, Washington;Unknown;Unknown;vandalism, physical
Public Appeal due to Severe Weather - Cold;1/23/2014;16:00;1/24/2014;0:00;Tennessee Valley Authority;Tennessee;Unknown;Unknown;severe weather, cold
Public Appeal due to Severe Weather - Cold;1/23/2014;4:00;1/24/2014;0:00;Memphis Light Gas and Water Division;Tennessee;Unknown;Unknown;severe weather, cold
Public Appeal due to Severe Weather - Cold;1/23/2014;13:04;1/24/2014;9:00;PJM Interconnection;Maryland;Unknown;Unknown;severe weather, cold
Vandalism;1/25/2011;3:23;1/25/2011;11:00;Atlantic City Electric;Newark, Delaware;0;0;vandalism
Physical Attack - Vandalism;1/25/2014;10:00;1/25/2014;11:00;Madison Gas and Electric;Madison, Wisconsin;Unknown;Unknown;vandalism, physical
Vandalism;1/27/2011;9:30;1/27/2011;9:30;Delmarva Power & Light Company;Hockessin, Delaware;0;0;vandalism
Winter Storm;1/26/2011;19:43;1/27/2011;18:18;Dominion - Virginia Power;Northern Virginia;600;150084;severe weather, winter storm
Suspected Telecommunications Attack;1/26/2011;9:25;1/27/2011;17:00;NV Energy;Carson City, Nevada;0;0;vandalism, cyber
Vandalism;1/26/2011;9:33;1/27/2011;15:03;ITC Transmission;Michigan;0;0;vandalism
Vandalism;1/27/2012;9:40;1/27/2012;9:40;Tacoma Power (TPWR);Frederickson Substation, Spanaway, Washington;Unknown;Unknown;vandalism
Physical Attack - Vandalism;1/26/2014;21:00;1/27/2014;11:00;PacifiCorp;Oregon;Unknown;Unknown;vandalism, physical
Physical Attack;1/28/2013;16:46;1/28/2013;18:00;Tacoma Power (TPWR);Tacoma Narrows Crossing, Washington;Unknown;Unknown;vandalism, physical
Public Appeal due to Severe Weather - Cold;1/27/2014;14:20;1/28/2014;21:00;PJM Interconnection;Maryland;Unknown;Unknown;severe weather, cold
Winter Storm;1/26/2011;18:28;1/29/2011;17:00;Baltimore Gas and Electric Company;Maryland;Unknown;234326;severe weather, winter storm
Vandalism;1/29/2012;0:45;1/29/2012;0:45;Tacoma Power (TPWR);Roosevelt Substation, Tacoma, Washington;Unknown;Unknown;vandalism
Physical Attack - Vandalism;1/29/2014;16:00;1/29/2014;16:44;Madison Gas and Electric;Unknown;Unknown;Unknown;vandalism, physical
Fuel Supply Deficiency (Coal);1/27/2011;17:00;1/30/2011;5:00;AES Greenidge, LLC;Central New York;108;Unknown;fuel supply emergency, coal
Winter Storm;1/26/2011;17:00;1/31/2011;8:00;Potomac Electric Power Co/ PEPCO Holdings Inc.;Montgomery and Prince George's County, Maryland and District of Columbia;Unknown;210000;severe weather, winter storm
Severe Weather - Wind Storm;1/31/2013;6:30;1/31/2013;10:00;ISO New England;Connecticut;75;75000;severe weather, wind
Severe Weather - Wind Storm;1/31/2013;3:05;1/31/2013;4:48;Dominion Virginia Power;Central and Eastern Virginia;188;119000;severe weather, wind
Suspected physical attack;1/4/2012;0:14;1/4/2012;0:14;Tacoma Power (TPWR);Tacoma, Washington;Unknown;Unknown;vandalism, physical
Sabotage;1/5/2012;10:35;1/5/2012;12:25;American Electric Power;CSWS/AEP West territory, Oklahoma;0;0;vandalism
Suspected physical attack;1/5/2012;10:28;1/5/2012;12:25;Oklahoma Gas and Electric;Creek County, Oklahoma;Unknown;Unknown;vandalism, physical
Public Appeal due to Severe Weather - Cold;1/6/2014;22:00;1/6/2014;22:01;Louisville Gas & Electric Co;Kentucky;Unknown;Unknown;severe weather, cold
Voltage Reduction due to Severe Weather - Cold;1/6/2014;19:50;1/6/2014;20:49;UGI Utilities, Inc;Pennsylvania;200;62000;severe weather, cold
Voltage Reduction due to Severe Weather - Cold;1/6/2014;19:52;1/6/2014;20:45;Delmarva Power & Light Company;Delaware;Unknown;Unknown;severe weather, cold
Voltage Reduction due to Severe Weather - Cold;1/6/2014;19:50;1/6/2014;20:44;Potomac Electric Power Co;District of Columbia;Unknown;Unknown;severe weather, cold
Voltage Reduction due to Severe Weather - Cold;1/6/2014;19:50;1/6/2014;20:44;PJM Interconnection;Unknown;Unknown;Unknown;severe weather, cold
Voltage Reduction due to Severe Weather - Cold;1/6/2014;19:50;1/6/2014;20:44;PPL Electric Utilities Corp;Pennsylvania;Unknown;Unknown;severe weather, cold
Vandalism;1/6/2014;14:37;1/6/2014;14:38;PacifiCorp;Utah;Unknown;Unknown;vandalism
Physcial Attack, Vandalism;1/7/2013;10:43;1/7/2013;10:43;Delmarva Power & Light Company;Denton, Maryland;Unknown;Unknown;vandalism, physical
Voltage Reduction, Public Appeal, Load Shed 100+MW due to Severe Weather - Cold;1/7/2014;18:00;1/7/2014;23:00;South Carolina Electric and Gas;South Carolina;4853;677858;severe weather, cold
Voltage Reduction, Public Appeal due to Severe Weather - Cold;1/7/2014;7:58;1/7/2014;11:00;Duke Energy Progress;North Carolina;14435;Unknown;severe weather, cold, public appeal
Public Appeal due to Severe Weather - Cold;1/7/2014;6:00;1/7/2014;8:30;Tennessee Valley Authority;Northeast Tennessee;Unknown;Unknown;severe weather, cold
Public Appeal due to Severe Weather - Cold;1/7/2014;6:00;1/7/2014;8:30;Memphis Light Gas and Water Division;Tennessee;Unknown;Unknown;severe weather, cold
Severe Weather - Cold;1/7/2014;6:18;1/7/2014;6:19;PJM Interconnection;Pennsylvania;Unknown;Unknown;severe weather, cold
Public Appeal due to Severe Weather - Cold;1/6/2014;20:45;1/7/2014;21:00;PJM Interconnection;Unknown;Unknown;Unknown;severe weather, cold
Public Appeal due to Severe Weather - Cold;1/6/2014;7:01;1/7/2014;9:00;ERCOT;Texas;Unknown;Unknown;severe weather, cold
Voltage Reduction, Public Appeal, Load Shed 100+MW due to Severe Weather - Cold;1/8/2014;6:00;1/8/2014;9:00;South Carolina Electric and Gas;South Carolina;4545;677858;severe weather, cold
Voltage Reduction due to Severe Weather - Cold;1/8/2014;5:00;1/8/2014;6:30;American Electric Power;Unknown;576;Unknown;severe weather, cold
Public Appeal due to Severe Weather - Cold;1/7/2014;16:15;1/8/2014;13:20;Duke Energy Progress;North Carolina;Unknown;Unknown;severe weather, cold
Fuel Supply Emergency due to Severe Weather - Cold;1/7/2014;9:30;1/8/2014;9:30;Duke Energy Carolinas;Piedmont North Carolina, Piedmont South Carolina;Unknown;Unknown;severe weather, cold
Public Appeal due to Severe Weather - Cold;1/7/2014;21:00;1/8/2014;9:00;PJM Interconnection;Unknown;Unknown;Unknown;severe weather, cold
Vandalism;1/9/2012;14:30;1/9/2012;15:30;ISO New England/Convex;Watertown, Connecticut;Unknown;Unknown;vandalism
Fuel Supply Emergency - Natural Gas;1/7/2014;10:59;1/9/2014;9:00;Prairie Power, Inc.;Illinois;Unknown;Unknown;fuel supply emergency, natural gas
Vandalsim;10/11/2012;0:00;10/11/2012;12:01;Potomac Electric Power Company (PEPCO);Seat Pleasant, Maryland;0;0;vandalism
Physical Attack;10/11/2013;14:30;10/11/2013;18:30;MISO - Entergy;Keo, Arkansas;Unknown;Unknown;vandalism, physical
Vandalism;10/14/2011;14:20;10/14/2011;14:20;Atlantic City Electric;English Creek, New Jersey;0;0;vandalism
Electrical System Separation (Islanding);10/14/2012;10:36;10/14/2012;10:50;Pacific Gas & Electric Co;Northern California;3;2035;islanding
Vandalism, Theft;10/15/2012;14:15;10/15/2012;14:16;ISO New England;Southeast Vermont;0;0;vandalism, physical
Cyber Event with Potential to Cause Impact;10/16/2013;11:15;10/16/2013;18:00;Duke Energy Progress;Roxboro Plant, North Carolina;0;0;vandalism, cyber
Vandalism;10/17/2011;15:44;10/17/2011;15:44;Duke Energy;Southwest Ohio;7;2000;vandalism
Vandalism;10/17/2011;3:34;10/17/2011;10:42;Potomac Electric Power Company;Seat Pleasant, Maryland;0;0;vandalism
Suspected Physical Attack;10/18/2011;3:45;10/18/2011;5:25;PECO Energy;Holmesburg Substation, Philadelphia, Pennsylvania;0;0;vandalism, physical
Physical Attack;10/19/2013;14:32;10/19/2013;22:00;Pacific Gas & Electric Co;California;Unknown;Unknown;vandalism, physical
Vandalism;10/20/2011;7:15;10/20/2011;7:15;Atlantic City Electric;McKee, New Jersey;0;0;vandalism
Electrical System Separation (Islanding);10/21/2013;5:18;10/21/2013;5:33;Pacific Gas & Electric Co;Location Unknown;115;433;islanding
Physical Attack, Vandalism;10/22/2012;0:00;10/22/2012;12:01;Potomac Electric Power Company (PEPCO);Norbeck, Maryland;0;0;vandalism, physical
Transmission System Interruption;10/23/2012;9:10;10/23/2012;9:16;Crawfordsville Electric, Light & Power;Crawfordsville, Indiana;49;9800;transmission interruption
Physical Attack, Vandalism;10/24/2012;15:15;10/24/2012;15:16;Delmarva Power & Light Company;Frankford, Delaware;0;0;vandalism, physical
Physical Attack, Vandalism;10/24/2012;0:00;10/24/2012;12:01;Potomac Electric Power Company (PEPCO);Kingswood, Maryland;0;0;vandalism, physical
Suspected Physical Attack;10/24/2012;0:00;10/24/2012;12:01;Potomac Electric Power Company (PEPCO);Brighton, Maryland;0;0;vandalism, physical
Physical Attack, Vandalism;10/25/2012;18:51;10/25/2012;19:30;Delmarva Power & Light Company;Newark, Delaware;0;0;vandalism, physical
Physical Attack, Vandalism;10/25/2012;14:39;10/25/2012;18:00;Black Hills/Colorado Elec.Util;Pueblo, Colorado;0;0;vandalism, physical
Physical Attack, Vandalism;10/25/2012;0:00;10/25/2012;12:01;Potomac Electric Power Company (PEPCO);West Lanham, Maryland;Unknown;Unknown;vandalism, physical
Suspected Physical Attack;10/24/2011;23:37;10/26/2011;23:00;PJM Interconnection;Holmesburg Substation, Philadelphia, Pennsylvania;0;0;vandalism, physical
Suspected Physical Attack;10/26/2013;7:13;10/26/2013;7:14;Arizona Public Service Co;Arizona;Unknown;Unknown;vandalism, physical
Vandalism;10/27/2011;1:00;10/27/2011;2:36;Midwest ISO;Munster, Indiana;Unknown;Unknown;vandalism
Severe Weather;10/26/2011;5:00;10/27/2011;15:00;Public Service Company of Colorado;Denver, Ft. Collins, Colorado;Unknown;204000;severe weather
Severe Weather - Hail Storm;10/27/2013;4:27;10/27/2013;22:27;CenterPoint Energy;Houston, Texas;Unknown;171117;severe weather, hail
Suspected Physical Attack;10/29/2012;15:00;10/29/2012;15:01;Nevada Power Company d/b/a NV Energy;Las Vegas, Nevada;Unknown;Unknown;vandalism, physical
Physical Attack, Vandalism;10/29/2012;9:00;10/29/2012;9:01;City of Tacoma (TPWR);LaGrande, Washington;0;0;vandalism, physical
Physical Attack, Vandalism;10/30/2012;15:00;10/30/2012;15:01;Black Hills/Colorado Elec.Util;Pueblo, Colorado;Unknown;Unknown;vandalism, physical
Vandalism;10/30/2012;13:20;10/30/2012;13:25;ISO New England;Fitzwilliam, New Hampshire;0;0;vandalism
Physical Attack, Vandalism;10/30/2012;0:00;10/30/2012;12:02;Potomac Electric Power Company (PEPCO);Hyattsville, Maryland;0;0;vandalism, physical
Severe Weather - Hurricane Sandy;10/29/2012;18:12;10/30/2012;19:35;Dominion Virginia Power;Virginia;520;156000;severe weather, hurricane/tropical storm
Severe Weather - Hurricane Sandy;10/29/2012;14:40;10/30/2012;18:16;ISO New England obo NSTAR;Boston, Southeast Massachusetts;Unknown;50000;severe weather, hurricane/tropical storm
Severe Weather - Hurricane Sandy;10/29/2012;19:15;10/30/2012;15:02;ISO New England;Southeast and Seacoast Maine;Unknown;50000;severe weather, hurricane/tropical storm
Suspected Cyber Attack;6/21/2013;8:31;10/30/2013;14:09;ITC Transmission;Michigan, Iowa;Unknown;Unknown;vandalism, cyber
Severe Weather;10/29/2011;20:00;10/31/2011;20:00;Orange and Rockland Utilities, Inc;New Jersey, New York;Unknown;74000;severe weather
Severe Weather - Hurricane Sandy;10/29/2012;17:13;10/31/2012;11:00;Baltimore Gas & Electric Company;Greater Baltimore Maryland;0;219000;severe weather, hurricane/tropical storm
Severe Weather - Hurricane Sandy;10/29/2012;16:45;10/31/2012;11:00;ISO New England/PSNH;New Hampshire;Unknown;50000;severe weather, hurricane/tropical storm
Suspected Physical Attack;10/5/2012;17:30;10/5/2012;17:50;Western Area Power Authority - Sierra Nevada Region;Greater Sacramento, California;Unknown;Unknown;vandalism, physical
Vandalism;10/6/2011;11:07;10/6/2011;11:07;PacifiCorp;Oquirrh Substation, Utah;0;0;vandalism
Physical Attack;10/6/2013;7:25;10/6/2013;9:15;MISO - AECC;Jacksonville, Arkansas;Unknown;9200;vandalism, physical
Suspected Physical Attack;10/7/2011;8:04;10/7/2011;16:00;City of Tacoma - TPWR;Olympic Pipeline, Spanaway, Washington;Unknown;Unknown;vandalism, physical
Vandalsim;10/9/2012;0:00;10/9/2012;12:01;Potomac Electric Power Company (PEPCO);Seat Pleasant, Maryland;0;0;vandalism
Severe Weather - Nor'easter;10/30/2012;2:00;11/1/2012;22:00;Detroit Edison Co;Greater Detroit Michigan;Unknown;133777;severe weather, storm
Severe Weather - Hurricane Sandy;10/29/2012;14:45;11/1/2012;1:30;ISO New England/REMVEC;Eastern Massachusetts;Unknown;50000;severe weather, hurricane/tropical storm
Physical Attack - Vandalism;11/1/2013;13:26;11/1/2013;13:27;Delmarva Power & Light Company;Wilmington, Delaware;Unknown;Unknown;vandalism, physical
Winter Storm;11/6/2002;22:00;11/10/2002;0:00;Pacific Gas & Electric Co.;Northern and Central California;270;939000;severe weather, winter storm
Severe Weather - Hurricane Sandy;10/29/2012;13:00;11/12/2012;14:00;Long Island Power Authority (LIPA);Long Island, New York;0;632816;severe weather, hurricane/tropical storm
Electrical System Separation (Islanding);11/12/2013;14:04;11/12/2013;14:05;Pacific Gas & Electric Co;Valle, California;55;48400;islanding
Loss of Power from Wholesale Provider, Major Distribution Disruption;11/12/2013;9:14;11/12/2013;10:30;Farmers' Electric Coop, Inc;Eastern Central New Mexico;Unknown;Unknown;fuel supply emergency
Vandalism;11/13/2011;11:30;11/13/2011;12:00;ISO New England / obo Public Service of New Hampshire;Cate Road, Deerfield, New Hampshire;0;0;vandalism
Vandalism;11/14/2011;14:24;11/14/2011;14:24;Atlantic City Electric;McKee, New Jersey;0;0;vandalism
Suspected Cyber Attack;11/15/2012;21:09;11/15/2012;21:26;ITC Transmission;Iowa, Michigan;Unknown;Unknown;vandalism, cyber
Physical Attack, Vandalism;11/15/2012;5:38;11/15/2012;5:39;ISO New England;Southeast Massachusetts;0;0;vandalism, physical
Physical Attack - Vandalism;11/16/2013;15:15;11/16/2013;15:16;PacifiCorp;Salt Lake County, Utah;Unknown;Unknown;vandalism, physical
Severe Weather - Thunderstorms;11/17/2013;14:31;11/17/2013;22:30;Commonwealth Edison Co;Entire ComEd Territory Illinois;Unknown;190000;severe weather, thunderstorm
System-wide voltage reductions of 3 percent or more;11/17/2013;12:35;11/17/2013;13:40;City of Rochelle;Rochelle, Indiana;38;7500;voltage reduction
Fuel Supply Deficiency;11/17/2012;10:00;11/18/2012;10:00;ERCOT;Comanche Peak, Texas;1231;0;fuel supply emergency
Severe Weather - Thunderstorms;11/17/2013;16:19;11/18/2013;18:00;American Electric Power;Indiana, Michigan;Unknown;77346;severe weather, thunderstorm
Severe Weather;10/29/2011;16:16;11/2/2011;21:30;Consolidated Edison Company of NY, Inc;New York City area;Unknown;50000;severe weather
Severe Weather;10/29/2011;15:00;11/2/2011;8:15;Central Hudson Gas & Electric Corp.;Mid-Hudson Valley Region, New York;Unknown;145000;severe weather
Physical Attack, Vandalism;11/2/2012;9:30;11/2/2012;12:10;ISO New England;Concord, Vermont;0;0;vandalism, physical
Severe Weather - Hurricane Sandy;10/29/2012;9:00;11/2/2012;18:00;Delmarva Power & Light Company;Delaware, Maryland;Unknown;70000;severe weather, hurricane/tropical storm
Severe Weather - Nor'easter;10/29/2012;19:00;11/2/2012;5:00;American Electric Power;Indiana, Kentucky, Michigan, Ohio;Unknown;173273;severe weather, storm
Physical Attack - Vandalism;11/2/2013;8:25;11/2/2013;8:26;PacifiCorp;Salt Lake City, Utah;Unknown;Unknown;vandalism, physical
Physical Attack - Vandalism;11/20/2013;3:08;11/20/2013;3:09;Pacific Gas & Electric Co;Salt Lake County Utah;Unknown;Unknown;vandalism, physical
Severe Weather - Ice and Snow Storm;11/17/2013;7:00;11/20/2013;18:54;Detroit Edison Co;Michigan;Unknown;325325;severe weather, winter storm
Severe Weather - Thunderstorms;11/17/2013;16:47;11/20/2013;16:47;Duke Energy Midwest;Central Indiana;Unknown;61705;severe weather, thunderstorm
Severe Weather - Thunderstorms;11/17/2013;13:06;11/20/2013;13:06;Northern Indiana Public Service Company;North Central Indiana;Unknown;75065;severe weather, thunderstorm
Severe Weather - Tornadoes;11/17/2013;16:47;11/20/2013;11:59;Duke Energy Indiana Inc;Central Indiana;535;61705;severe weather, tornado
Severe Weather - Tornadoes;11/17/2013;12:35;11/20/2013;11:00;Ameren Missouri;Central Missouri, Central Illinois;Unknown;200000;severe weather, tornado
Ice Storm;11/17/2002;6:00;11/21/2002;8:00;Northeast Utilities;Northwest and North Central Connecticut;Unknown;224912;severe weather, winter storm
Physical Attack, Vandalism;11/21/2012;14:50;11/21/2012;14:51;Delmarva Power & Light Company;Bethany Beach, Delaware;Unknown;Unknown;vandalism, physical
Severe Weather - Thunderstorms;11/17/2013;16:45;11/21/2013;16:45;Consumers Energy Co;Entire Lower Peninsula Michigan;Unknown;50000;severe weather, thunderstorm
Suspected Physical Attack;11/22/2011;23:16;11/22/2011;23:16;Northern Indiana Public Service Co;Indiana;0;0;vandalism, physical
Severe Weather - Wind Storm;11/21/2013;19:45;11/22/2013;3:20;Pacific Gas & Electric Co;Northern California;150;89500;severe weather, wind
Physical Attack - Vandalism;11/24/2013;7:38;11/24/2013;7:39;Pacific Gas & Electric Co;Salt Lake County Utah;Unknown;Unknown;vandalism, physical
Physical Attack, Vandalism;11/26/2012;15:07;11/26/2012;15:08;Delmarva Power & Light Company;Georgetown, Delaware;Unknown;Unknown;vandalism, physical
Physical Attack, Vandalism;11/26/2012;0:37;11/26/2012;0:38;Delmarva Power & Light Company;Frankfort, Delaware;0;0;vandalism, physical
Physical Attack, Vandalism;11/27/2012;13:07;11/27/2012;13:40;ISO New England;New Hampshire;0;0;vandalism, physical
Severe Weather;10/29/2011;12:57;11/3/2011;23:00;PPL Electric Utilities;Harrisburg, Lehigh Valley, Lancaster Region Pennsylvania;Unknown;146721;severe weather
Severe Weather - Hurricane Sandy;10/29/2012;18:46;11/3/2012;10:45;Orange and Rockland Utilities, Inc.;Southeast New York, New Jersey;Unknown;200000;severe weather, hurricane/tropical storm
Vandalism;11/30/2011;10:00;11/30/2011;11:00;City of Tacoma - TPWR;Orchard Substation, Washington;0;0;vandalism
Vandalism;11/4/2011;10:46;11/4/2011;10:46;PacifiCorp;Sweetwater County, Wyoming;0;0;vandalism
Severe Weather;10/29/2011;11:18;11/4/2011;12:00;New York State Elec & Gas Corp;Southeast New York;Unknown;161151;severe weather
Severe Weather - Hurricane Sandy;10/29/2012;12:00;11/4/2012;23:00;FirstEnergy Corp: Jersey Central Power & Light;New Jersey;Unknown;217000;severe weather, hurricane/tropical storm
Severe Weather - Hurricane Sandy;10/29/2012;8:00;11/4/2012;23:00;Atlantic City Electric Co;New Jersey;Unknown;Unknown;severe weather, hurricane/tropical storm
Severe Weather - Hurricane Sandy;10/29/2012;18:11;11/4/2012;22:50;PPL Electric Utilities Corp;Central Pennsylvania;Unknown;400000;severe weather, hurricane/tropical storm
Severe Weather - Hurricane Sandy;10/29/2012;15:15;11/4/2012;20:00;ISO New England/CONVEX;Connecticut, Western Massachusetts;0;649075;severe weather, hurricane/tropical storm
Severe Weather - Hurricane Sandy;10/29/2012;18:48;11/4/2012;11:36;Iberdrola USA (NYSEG);New York;Unknown;371000;severe weather, hurricane/tropical storm
Physical Attack - Vandalism;11/4/2013;9:04;11/4/2013;9:05;ISO New England;Connecicut;Unknown;Unknown;vandalism, physical
Severe Weather - Heavy Winds;11/2/2013;0:00;11/4/2013;6:00;Puget Sound Energy;King, Whatcom, and Skagit, Washington;Unknown;105000;severe weather, wind
Severe Weather - Hurricane Sandy;10/29/2012;16:00;11/5/2012;23:59;FirstEnergy Corp: CEI;Greater Cleveland Ohio;0;346000;severe weather, hurricane/tropical storm
Severe Weather;10/29/2011;14:30;11/6/2011;0:00;Public Service Electric and Gas Company;New Jersey;125;197000;severe weather
Severe Weather - Hurricane Sandy;10/29/2012;16:03;11/6/2012;0:00;PSE&G;New Jersey;Unknown;50000;severe weather, hurricane/tropical storm
Severe Weather - Hurricane Sandy;10/29/2012;17:30;11/6/2012;12:00;Exelon Corporation/PECO;Greater Philadelphia Pennsylvania;Unknown;850000;severe weather, hurricane/tropical storm
Severe Weather;10/29/2011;8:59;11/7/2011;19:58;Metropolitan Edison Company;Pennsylvania;Unknown;312359;severe weather
Severe Weather;10/29/2011;16:14;11/7/2011;16:00;ISO New England;Connecticut, Maine, Massachusetts, New Hampshire, Rhode Island;Unknown;1418100;severe weather
Severe Weather;10/29/2011;8:59;11/7/2011;15:00;Potomac Edison;Pennsylvania;Unknown;50000;severe weather
Severe Weather;10/29/2011;9:59;11/7/2011;13:00;Jersey Central Power & Light Company;Northwest and Central New Jersey;Unknown;379000;severe weather
Physical Attack, Vandalism;11/7/2012;14:21;11/7/2012;14:48;ISO New England;New Hampshire;0;0;vandalism, physical
Severe Weather - Hurricane Sandy;10/29/2012;16:00;11/7/2012;23:48;FirstEnergy Corp: Met-Ed;Eastern Pennsylvania;0;270000;severe weather, hurricane/tropical storm
Physical Attack;11/5/2013;10:10;11/7/2013;10:10;Duke Energy Indiana Inc;Indiana;Unknown;Unknown;vandalism, physical
Physical Attack, Vandalism;11/8/2012;9:34;11/8/2012;9:35;Delmarva Power & Light Company;Bishopville, Maryland;0;0;vandalism, physical
Severe Weather - Hurricane Sandy;10/29/2012;16:01;11/8/2012;19:00;Consolidated Edison Co-NY Inc;Greater New York City, New York;0;818000;severe weather, hurricane/tropical storm
Severe Weather - Hurricane Sandy;10/29/2012;16:00;11/8/2012;17:08;FirstEnergy Corp: Potomac Edison;Maryland, West Virginia;Unknown;150000;severe weather, hurricane/tropical storm
Severe Weather - Hurricane Sandy;10/29/2012;0:00;11/9/2012;23:59;FirstEnergy Corp: Mon Power Company;West Virginia;0;208000;severe weather, hurricane/tropical storm
Suspected Physical Attack;12/10/2013;1:01;12/11/2013;1:01;Arizona Public Service Co;Arizona;Unknown;Unknown;vandalism, physical
